<?xml version="1.0" encoding="UTF-8"?>
<mappers xmlns="http://www.weimingfj.com" xmlns:xsi="http://www.w3.org/2001/XMLSchema-instance"
	xsi:schemaLocation="http://itest.56913.com:20080/xsd/mappers.xsd">
	<!-- 首页加载货源 -->
	<mapper id="loadCargoInfo">
		<sql key="loadCargoInfo" operator="select" resultType="paging">
			select
			<isNotEmpty property="query_count"> count(1) </isNotEmpty>
			<isEmpty property="query_count">
				DATE_FORMAT(c.create_time,"%Y-%m-%d %T") create_time1,c.*,c.pub_name MEMBER_NAME,( select count(1) from
				collect where 1=1 and member_id='$_CRU_USER_ID_$'
				and collect_type=1 and collect_id=c.SEQ ) as TYPE,(select
				user_auth_status from sys_user_tab where user_id=c.user_id)
				ua,(select company_auth_status from sys_user_tab where
				user_id=c.user_id) ca,
				(select count(1) from yb_vip_user_today_his yvut where yvut.userid='$_CRU_USER_ID_$' and yvut.code='HYXX' and yvut.object_id=c.SEQ and source='WEB') isshow 
			</isEmpty>
			from sys_cargo_tab c where 1=1 and c.is_delete='N'  
			<isNotEmpty property="IS_VIP">
				and c.VIP = #{IS_VIP}
			</isNotEmpty>
			<isNotEmpty property="QUERY_SOURCE">
				and c.S_CODE_VAL like '${QUERY_SOURCE}%'
			</isNotEmpty>
			<isNotEmpty property="QUERY_DESTINATION">
				and c.T_CODE_VAL like '${QUERY_DESTINATION}%'
			</isNotEmpty>
			<isNotEmpty property="QUERY_TRUCK_TYPE">
				and c.C_TYPE = '${QUERY_TRUCK_TYPE}'
			</isNotEmpty>
			<isNotEmpty property="QUERY_TRUCK_LENGHT">
				and c.C_LENGTH = ${QUERY_TRUCK_LENGHT}
			</isNotEmpty>
			<isNotEmpty property="QUERY_TRUCK_LOAD">
				and c.G_SIZE = ${QUERY_TRUCK_LOAD}
			</isNotEmpty>
      <isNotEmpty property="QUERY_TRUCK_LOAD_TYPE">
        and c.G_TYPE = '${QUERY_TRUCK_LOAD_TYPE}'
      </isNotEmpty>

			<isNotEmpty property="topTime">
				and c.CREATE_TIME >DATE_FORMAT(#{topTime},"%Y-%m-%d %T")
			</isNotEmpty>
			<isNotEmpty property="bottomTime">
				and c.CREATE_TIME &lt; DATE_FORMAT(#{bottomTime},"%Y-%m-%d %T")
			</isNotEmpty>
			<isNotEmpty property="vip">
				and c.vip = ${vip}
			</isNotEmpty>
			<isEmpty property="query_count">
				ORDER BY c.CREATE_TIME desc
				<isNotEmpty property="pager">
					LIMIT ${PAGESTART}, ${PAGENUM}
				</isNotEmpty>
			</isEmpty>
		</sql>
	</mapper>
	<!-- 获取单个货源信息 -->
	<mapper id="getCargoInfoById">
		<sql key="getCargoInfoById" resultType="map" operator="select">
			select DATE_FORMAT(c.CREATE_TIME,"%Y-%m-%d %T") f_pub_time, c.*
			from sys_cargo_tab c where 1=1 and c.seq=#{CARGO_ID}
		</sql>
	</mapper>

	<!-- 添加单个货源信息 -->
	<mapper id="addCargoInfo">

<!--  		<sql key="S_AREA" operator="select"> -->
<!--  			select full_text S_AREA1 from base_area_tab t where t.code= #{S_CODE_VAL} -->
<!--  		</sql> -->
<!--  		<sql key="T_AREA" operator="select"> -->
<!--  			select full_text T_AREA1 from base_area_tab t where t.code= #{T_CODE_VAL} -->
<!--  		</sql> -->
		<sql operator="callback" class="syncCargoCallBack" /><!-- 货源的uuid在这里生成,同步货源到嘉兴交易大厅 -->
		<sql key="addCargoInfo" operator="execute">
			INSERT INTO sys_cargo_tab
			(SEQ,CARGO_TIME_END,PRICE,UNIT,S_CODE_VAL,T_CODE_VAL,G_TYPE,G_SIZE,G_SIZE_TYPE,C_LENGTH,C_TYPE,CON_PHONE,CON_MAN,STATE,CREATE_TIME,PUB_NAME,PUB_MOBILE,remark,
			PUB_COMPANY,SEARCH_KEY,S_AREA,T_AREA,SOURCE_WAY,USER_ID, IS_DELETE,VIP)
			VALUES(#{cargoId},#{CARGO_TIME_END},#{yf},#{cargo_yf_unit},#{S_CODE_VAL},#{T_CODE_VAL},#{G_TYPE},#{G_SIZE},#{G_SIZE_TYPE},#{C_LENGTH},#{C_TYPE},#{CON_PHONE},#{CON_MAN},0,now(),
			(select user_name from sys_user_tab where user_id='$_CRU_USER_ID_$'),
			(select tel from sys_user_tab where user_id='$_CRU_USER_ID_$'),
			'${remark1}${REMARK2}',#{PUB_COMPANY},
			CONCAT((select city_text from base_area_tab t where t.code= #{S_CODE_VAL}),
			(select city_text from base_area_tab t where t.code= #{T_CODE_VAL}),#{G_SIZE},#{G_SIZE_TYPE},#{G_TYPE},#{C_LENGTH},'米',#{C_TYPE},DATE_FORMAT(now(),'%Y-%m-%d')),
			(select full_text S_AREA from base_area_tab t where t.code= #{S_CODE_VAL}),(select full_text T_AREA1 from base_area_tab t where t.code= #{T_CODE_VAL}),#{SOURCE_WAY},'$_CRU_USER_ID_$','N',${is_cargo_vip})
		</sql>
		<sql operator="callback" class="pointsCallBack" />
		<sql operator="callback" class="sendMsg" />

	</mapper>

	<!-- 获取动态信息货源 -->
	<mapper id="getSyncCargo">
		<sql key="getSyncCargo" resultType="list" operator="select">
			select u.user_name,c.S_AREA,c.T_AREA,c.CREATE_TIME 
			from sys_cargo_tab c
			LEFT JOIN sys_user_tab u on c.USER_ID = u.user_id
			where 
				c.is_delete = 'N'  and u.user_name !='' and u.is_del = 'N'
			ORDER BY c.CREATE_TIME desc
			LIMIT 100
		</sql>
	</mapper>
	<!-- 获取热门合作企业 -->
	<mapper id="getHotPartner">
		<sql key="getHotPartner" resultType="list" operator="select">
			SELECT
				con.content_id,
				jce.title
			FROM
				qhcms.jc_content con
			left join qhcms.jc_content_ext jce on jce.content_id = con.content_id
			WHERE
				channel_id = (select text from sys_dict_tab where type='QHCMS_CHANNEL_ID' and is_del='N')
			limit 10
		</sql>
	</mapper>

</mappers>

